{
    "week":  "2026-W18",
    "author":  "ricardo",
    "source_window":  {
                          "start":  "2026-04-27",
                          "end":  "2026-05-03"
                      },
    "summary":  "CogniFlow consolidated setup runtime and installer contracts, creating a clearer boundary between orchestration logic and execution responsibilities.",
    "areas":  [
                  "installation",
                  "runtime-environment",
                  "workflow-orchestration"
              ]
}
