{
    "week":  "2025-W52",
    "author":  "gerrit",
    "source_window":  {
                          "start":  "2025-12-22",
                          "end":  "2025-12-28"
                      },
    "summary":  "CogniFlow added a pipeline-runner service with management CLI support, enabling more direct control of pipeline execution and runtime behavior.",
    "areas":  [
                  "workflow-orchestration",
                  "command-line-tools",
                  "data-processing"
              ]
}
