{
    "week":  "2026-W19",
    "author":  "ricardo",
    "source_window":  {
                          "start":  "2026-05-04",
                          "end":  "2026-05-10"
                      },
    "summary":  "CogniFlow expanded Windows publishing workflows for core service packages and tightened repository governance checks, improving controlled release preparation.",
    "areas":  [
                  "release-engineering",
                  "governance",
                  "installation"
              ]
}
